row_id,component,source,status,detail,score_blocker
WGD_DELAY_LINKAGE_001,published_time_delay_measurement_statement,TDCOSMO XVI arXiv:2406.02683v2 / A&A 2024,literature_support_present,"The paper states that WGD2038 has new time-delay measurements, uses delays relative to image A, and uses the corresponding covariance matrix in the cosmographic inference.",False
WGD_DELAY_LINKAGE_002,machine_readable_observed_delay_vector,TDCOSMO XVI Fig. 2 transcription artifact,present_transcribed_from_publication,"The published AB/AC/AD delay vector and covariance are now materialized in a local artifact with the publication convention Delta_t_AX=t_A-t_X. This removes the observed-delay-vector blocker, but does not supply a converged/published WGD Fermat posterior.",False
WGD_DELAY_LINKAGE_003,Ddt_weight_support,TDCOSMO2025 WGD2038 processed pickle and Ddt CSV,present,"567880 Ddt samples and weights are materialized, but these are compressed cosmographic support rather than the observed image-delay vector itself.",False
WGD_DELAY_LINKAGE_004,local_bounded_fermat_parity_table,local bounded WGD diagnostic outputs,diagnostic_only_present,"12 image rows across 3 bounded local jobs contain image coordinates, Fermat potentials, and Morse/parity labels.",False
WGD_DELAY_LINKAGE_005,no_T2_residual_vector,derived from observed delays minus model delays,diagnostic_smoke_only_not_score_ready,A bounded no-T2 residual smoke is now derivable after sign-convention alignment. It is not score-ready because the Fermat basis is a local non-converged preflight rather than a converged or published WGD posterior.,True
WGD_DELAY_LINKAGE_006,predeclared_delay_shape_holdout_target,TDCOSMO IX published model predictions plus TDCOSMO XVI observed delays,present_not_endpoint_blind,"A published-model delay-shape target is frozen before any posterior-level WGD score. It can constrain a future comparison, but it is not endpoint-blind and is not itself a posterior-level score.",False
